{
  "$schema": "../schema.json",
  "id": "ke-payroll",
  "country": "KE",
  "currency": "KES",
  "version": "1.0.0",
  "verification": "draft",
  "sources": [
    {
      "id": "kra-paye",
      "title": "Pay As You Earn (PAYE): individual income tax rates (bands) per the Finance Act 2023, effective 1 July 2023, and personal tax relief",
      "publisher": "Kenya Revenue Authority",
      "url": "https://www.kra.go.ke/individual/filing-paying/types-of-taxes/paye",
      "retrieved": "2026-10-26"
    },
    {
      "id": "kra-notice-2157",
      "title": "Public notice 19/12/2024: Amendments to PAYE Computation Pursuant to the Tax Laws (Amendment) Act, 2024 (in force 27 December 2024, applicable to December 2024 and subsequent periods)",
      "publisher": "Kenya Revenue Authority",
      "url": "https://www.kra.go.ke/news-center/public-notices/2157-amendments-to-paye-computation-pursuant-to-the-tax-laws-amendment-act,-2024",
      "retrieved": "2026-10-26"
    },
    {
      "id": "kra-notice-2152",
      "title": "Public notice 08/11/2024: Applicability of Insurance Relief to Contributions made to the Social Health Insurance Fund (SHIF)",
      "publisher": "Kenya Revenue Authority",
      "url": "https://www.kra.go.ke/news-center/public-notices/2152-applicability-of-insurance-relief-to-contributions-made-to-the-social-health-insurance-fund-shif",
      "retrieved": "2026-10-26"
    },
    {
      "id": "kra-notice-2099",
      "title": "Public notice 21/03/2024: Collection of Affordable Housing Levy by Kenya Revenue Authority (1.5% employee and 1.5% employer of gross monthly salary, with effect from 19 March 2024)",
      "publisher": "Kenya Revenue Authority",
      "url": "https://www.kra.go.ke/news-center/public-notices/2099-collection-of-the-affordable-housing-levy-by-kenya-revenue-authority",
      "retrieved": "2026-10-26"
    },
    {
      "id": "kra-faq-reliefs",
      "title": "KRA FAQ: Tax Reliefs (personal relief; insurance relief at 15% of premiums up to KShs 60,000 per annum)",
      "publisher": "Kenya Revenue Authority",
      "url": "https://www.kra.go.ke/component/kra_faq/faq/733",
      "retrieved": "2026-10-26"
    },
    {
      "id": "sha-premium-rates",
      "title": "Premium Rates: SHIF contributions of 2.75% of gross monthly income, minimum KSh 300 per month, no upper limit",
      "publisher": "Social Health Authority",
      "url": "https://www.sha.go.ke/resources/premium-rates",
      "retrieved": "2026-10-26"
    },
    {
      "id": "sha-employer-terms",
      "title": "SHA Employer Portal Terms and Conditions (effective date 1 October 2024)",
      "publisher": "Social Health Authority",
      "url": "https://employers.sha.go.ke/terms-and-conditions",
      "retrieved": "2026-10-26",
      "note": "States an effective date of 1 October 2024 for the employer portal's contribution terms; it does not cite the regulation that fixed the start of SHIF deductions."
    },
    {
      "id": "nssf-notice-year-2",
      "title": "Notice to Employers on the updated NSSF rates: Year 2 contribution rates, effective February 2024 payroll, per the Third Schedule of the NSSF Act 2013 (published as an image, read from the notice poster)",
      "publisher": "National Social Security Fund",
      "url": "https://www.nssf.or.ke/notice-to-employers-on-the-updated-nssf-rates",
      "retrieved": "2026-10-26"
    },
    {
      "id": "nssf-notice-year-4",
      "title": "Notice to Employers: Year 4 (2026) NSSF contribution rates, effective February 2026, per the Third Schedule of the NSSF Act Cap 258; states that Year 3 rates ended on 31 January 2026 (published as an image, read from the notice)",
      "publisher": "National Social Security Fund",
      "url": "https://www.nssf.or.ke/notice-to-employers-year-4-2026-nssf-contribution-rates",
      "retrieved": "2026-10-26"
    },
    {
      "id": "nssf-contribution-rates-2014",
      "title": "New NSSF Member Contributions: the NSSF Act 2013 computation guidelines (upper earnings limit KES 18,000, lower earnings limit KES 6,000, 6% employee and 6% employer)",
      "publisher": "National Social Security Fund",
      "url": "https://www.nssf.or.ke/new-contribution-rates",
      "retrieved": "2026-10-26",
      "note": "A 2014 page describing the Act's first limits; it is not a Year 1 (2023) implementation notice."
    },
    {
      "id": "nita-levy",
      "title": "Levy Inspectorate: industrial training levy, currently Kshs. 50 per employee per month, not a deduction from payroll",
      "publisher": "National Industrial Training Authority",
      "url": "https://nita.go.ke/our-services/levy-inspectorate.html",
      "retrieved": "2026-10-26",
      "note": "The page states the amount that is current on the retrieval date and does not date it."
    }
  ],
  "rounding": { "mode": "half_up" },
  "inputs": [
    { "key": "insurancePremiums", "labelKey": "input.insurancePremiums", "deductedFromPay": false },
    { "key": "pensionContribution", "labelKey": "input.pensionContribution", "deductedFromPay": true },
    { "key": "mortgageInterest", "labelKey": "input.mortgageInterest", "deductedFromPay": false },
    { "key": "postRetirementMedical", "labelKey": "input.postRetirementMedical", "deductedFromPay": false }
  ],
  "order": ["nssf", "shif", "ahl", "nita", "paye"],
  "rules": [
    {
      "ruleId": "nssf",
      "kind": "social_security",
      "labelKey": "rule.nssf",
      "effectiveFrom": "2023-02-01",
      "effectiveTo": "2024-01-31",
      "sourceRef": "nssf-contribution-rates-2014",
      "verification": "draft",
      "note": "NSSF Year 1. The limits are the NSSF Act 2013's first limits (KES 6,000 and KES 18,000) from an NSSF page; no NSSF Year 1 implementation notice was fetched, so the period they applied to is unconfirmed.",
      "params": {
        "base": "gross_pay",
        "lowerEarningsLimit": "6000.00",
        "upperEarningsLimit": "18000.00",
        "employeeRate": "0.06",
        "employerRate": "0.06"
      }
    },
    {
      "ruleId": "nssf",
      "kind": "social_security",
      "labelKey": "rule.nssf",
      "effectiveFrom": "2024-02-01",
      "effectiveTo": "2025-01-31",
      "sourceRef": "nssf-notice-year-2",
      "verification": "verified",
      "note": "NSSF Year 2: lower limit KES 7,000, upper limit KES 36,000, 6% employee and 6% employer, effective February 2024 payroll.",
      "params": {
        "base": "gross_pay",
        "lowerEarningsLimit": "7000.00",
        "upperEarningsLimit": "36000.00",
        "employeeRate": "0.06",
        "employerRate": "0.06"
      }
    },
    {
      "ruleId": "nssf",
      "kind": "social_security",
      "labelKey": "rule.nssf",
      "effectiveFrom": "2025-02-01",
      "effectiveTo": "2026-01-31",
      "sourceRef": "nssf-notice-year-4",
      "verification": "draft",
      "note": "NSSF Year 3. The Year 4 notice confirms that Year 3 ended on 31 January 2026, but no NSSF document stating the Year 3 limits (KES 8,000 and KES 72,000) was fetched; they are the figures the secondary sources give and sit on the progression between the Year 2 and Year 4 notices.",
      "params": {
        "base": "gross_pay",
        "lowerEarningsLimit": "8000.00",
        "upperEarningsLimit": "72000.00",
        "employeeRate": "0.06",
        "employerRate": "0.06"
      }
    },
    {
      "ruleId": "nssf",
      "kind": "social_security",
      "labelKey": "rule.nssf",
      "effectiveFrom": "2026-02-01",
      "effectiveTo": null,
      "sourceRef": "nssf-notice-year-4",
      "verification": "verified",
      "note": "NSSF Year 4: lower limit KES 9,000, upper limit KES 108,000, 6% employee and 6% employer, effective February 2026 payroll. Year 4 is the last year of the Third Schedule's phase-in; a later change to the limits needs a new entry.",
      "params": {
        "base": "gross_pay",
        "lowerEarningsLimit": "9000.00",
        "upperEarningsLimit": "108000.00",
        "employeeRate": "0.06",
        "employerRate": "0.06"
      }
    },
    {
      "ruleId": "shif",
      "kind": "health_insurance",
      "labelKey": "rule.shif",
      "effectiveFrom": "2023-07-01",
      "effectiveTo": "2024-09-30",
      "sourceRef": "sha-employer-terms",
      "verification": "draft",
      "notModelled": "NHIF graduated contributions applied before the Social Health Insurance Act took effect; the NHIF table was not fetched and is not in this pack."
    },
    {
      "ruleId": "shif",
      "kind": "health_insurance",
      "labelKey": "rule.shif",
      "effectiveFrom": "2024-10-01",
      "effectiveTo": null,
      "sourceRef": "sha-premium-rates",
      "verification": "draft",
      "note": "The rate (2.75% of gross monthly income) and the minimum (KSh 300) are read from SHA. The start of employer deductions is taken as 1 October 2024 from the SHA employer portal terms' effective date, not from the regulation that fixed it, so the entry stays draft.",
      "params": {
        "base": "gross_pay",
        "rate": "0.0275",
        "minimum": "300.00",
        "maximum": null
      }
    },
    {
      "ruleId": "ahl",
      "kind": "levy",
      "labelKey": "rule.ahl",
      "effectiveFrom": "2023-07-01",
      "effectiveTo": "2024-03-31",
      "sourceRef": "kra-notice-2099",
      "verification": "draft",
      "notModelled": "The Affordable Housing Levy is collected under the Affordable Housing Act 2024 with effect from 19 March 2024; March 2024 is a part-month and any levy before the Act is not modelled."
    },
    {
      "ruleId": "ahl",
      "kind": "levy",
      "labelKey": "rule.ahl",
      "effectiveFrom": "2024-04-01",
      "effectiveTo": null,
      "sourceRef": "kra-notice-2099",
      "verification": "verified",
      "note": "1.5% of gross monthly salary by the employee and 1.5% by the employer (Affordable Housing Act 2024, collected by KRA with effect from 19 March 2024; the first whole month is April 2024).",
      "params": {